{
  "spec_version": "1.0.0",
  "package": {
    "id": "offisim.employee.writer_pro",
    "kind": "employee",
    "version": "1.2.0",
    "title": "Writer Pro",
    "summary": "Long-form writing employee with review handoff.",
    "license": "MIT",
    "publisher": {
      "creator_handle": "alice",
      "display_name": "Alice"
    }
  },
  "compatibility": {
    "runtime_range": ">=1.0 <2.0",
    "schema_version": "2026-03",
    "supported_environments": [
      "desktop",
      "docker"
    ]
  },
  "lineage": {
    "origin_package_id": "offisim.employee.writer_base",
    "forked_from_version": "1.0.0"
  },
  "requirements": {
    "required_capabilities": [
      "chat",
      "docs.write"
    ],
    "required_mcps": [],
    "recommended_models": [
      {
        "profile": "reasoning-heavy",
        "reason": "outline and critique"
      },
      {
        "profile": "cheap-draft",
        "reason": "bulk drafting"
      }
    ]
  },
  "permissions": {
    "risk_class": "logic_asset",
    "declares_secrets": false,
    "filesystem_scope": "workspace",
    "network_scope": "limited"
  },
  "assets": [
    {
      "asset_id": "writer-pro-default",
      "kind": "employee",
      "path": "assets/employee.writer-pro.json",
      "entrypoint": "default",
      "default_enabled": true,
      "recommended_models": [
        "reasoning-heavy",
        "cheap-draft"
      ]
    }
  ],
  "distribution": {
    "source_url": "https://market.example/packages/writer-pro-1.2.0.offisimpkg",
    "mirror_policy": "registry_or_external",
    "artifact_size_bytes": 128304
  },
  "integrity": {
    "package_sha256": "9f2c9f2c9f2c9f2c9f2c9f2c9f2c9f2c9f2c9f2c9f2c9f2c9f2c9f2c9f2c9f2c",
    "files": [
      {
        "path": "assets/employee.writer-pro.json",
        "sha256": "8a1f8a1f8a1f8a1f8a1f8a1f8a1f8a1f8a1f8a1f8a1f8a1f8a1f8a1f8a1f8a1f"
      }
    ]
  },
  "previews": {
    "icon_path": "previews/icon.png",
    "readme_path": "README.md"
  }
}